{
  "version": 2,
  "status": "PROPOSED_SOURCE_AUTHORIZED_FOUNDATION_PENDING_OWNER_REVIEW",
  "baseCommit": "5dc59c44020a135934d1b8cefceae9606bfa736f",
  "fixtureIndependence": {
    "prohibitedPins": [
      "6/6/2525",
      "00:03",
      "age 44 only",
      "2026-08-29",
      "Candidate 0011 reader text"
    ],
    "reusableAcrossContexts": true,
    "reusableAcrossFixtures": true,
    "reusableAcrossAges": true,
    "reusableAcrossAsOfDates": true
  },
  "predictionContract": {
    "broadTrendMinimum": [
      "placement fact",
      "reusable source rule",
      "passed applicability",
      "zero unresolved conflicts"
    ],
    "specificEventMinimum": [
      "source-direct statement for that event",
      "or Owner-authorized multi-signal synthesis"
    ],
    "prohibitedEscalations": [
      "job promotion",
      "job change",
      "marriage",
      "breakup",
      "medical diagnosis",
      "specific amount",
      "windfall",
      "specific month or day"
    ]
  },
  "counts": {
    "rules": 21,
    "planetSemanticRules": 8,
    "taksaDomainRules": 8,
    "houseDirectionRules": 2,
    "kalakiniInversionRules": 2,
    "periodRules": 1
  },
  "rules": [
    {
      "rule_id": "MH2537-PLANET-SUN",
      "rule_type": "PLANET_SEMANTIC_SCOPE",
      "source_tier": 0,
      "source_refs": [
        "SRC-MH2537-PLANET-SYSTEM"
      ],
      "applicable_planets": [
        "sun"
      ],
      "applicable_taksa_roles": [
        "boriwan",
        "ayu",
        "det",
        "sri",
        "mula",
        "utsaha",
        "montri",
        "kalakini"
      ],
      "applicable_mahabhut_status_or_house": [
        "thongchai",
        "khumsap",
        "racha",
        "athibodi",
        "phangkha",
        "marana",
        "puti"
      ],
      "required_conditions": [
        "planet matches the life-period placement",
        "combine with an applicable Taksa-role rule and house-direction rule"
      ],
      "excluded_conditions": [
        "standalone planet keyword as prediction",
        "medical diagnosis",
        "personality substitution"
      ],
      "applicable_domains": [
        "leadership",
        "authority",
        "home_leadership"
      ],
      "period_applicability": "Only the matched planet life period recorded by the source table.",
      "allowed_conclusions": [
        "Use ผู้ใหญ่ ผู้ปกครอง อำนาจ และบทบาทนำ only to bound the subject affected by the matched house direction."
      ],
      "prohibited_escalations": [
        "specific event",
        "specific disease",
        "specific amount",
        "month or day timing",
        "different planet or life period"
      ],
      "claim_strength": "SOURCE_SEMANTIC_COMPONENT_NOT_STANDALONE_PREDICTION",
      "conflict_priority": 30,
      "reader_language_boundary": "Name the affected area in ordinary Thai; do not repeat historical disease or stereotype lists.",
      "authority_kind": "PRODUCT_INTERPRETATION_BOUNDARY",
      "evidence_completeness_status": "COMPLETE"
    },
    {
      "rule_id": "MH2537-PLANET-MOON",
      "rule_type": "PLANET_SEMANTIC_SCOPE",
      "source_tier": 0,
      "source_refs": [
        "SRC-MH2537-PLANET-SYSTEM"
      ],
      "applicable_planets": [
        "moon"
      ],
      "applicable_taksa_roles": [
        "boriwan",
        "ayu",
        "det",
        "sri",
        "mula",
        "utsaha",
        "montri",
        "kalakini"
      ],
      "applicable_mahabhut_status_or_house": [
        "thongchai",
        "khumsap",
        "racha",
        "athibodi",
        "phangkha",
        "marana",
        "puti"
      ],
      "required_conditions": [
        "planet matches the life-period placement",
        "combine with an applicable Taksa-role rule and house-direction rule"
      ],
      "excluded_conditions": [
        "standalone planet keyword as prediction",
        "medical diagnosis",
        "personality substitution"
      ],
      "applicable_domains": [
        "care",
        "mobility",
        "finance"
      ],
      "period_applicability": "Only the matched planet life period recorded by the source table.",
      "allowed_conclusions": [
        "Use ผู้ดูแล การเดินทาง การเงิน และสิ่งแวดล้อมที่หล่อเลี้ยงชีวิต only to bound the subject affected by the matched house direction."
      ],
      "prohibited_escalations": [
        "specific event",
        "specific disease",
        "specific amount",
        "month or day timing",
        "different planet or life period"
      ],
      "claim_strength": "SOURCE_SEMANTIC_COMPONENT_NOT_STANDALONE_PREDICTION",
      "conflict_priority": 30,
      "reader_language_boundary": "Name the affected area in ordinary Thai; do not repeat historical disease or stereotype lists.",
      "authority_kind": "PRODUCT_INTERPRETATION_BOUNDARY",
      "evidence_completeness_status": "COMPLETE"
    },
    {
      "rule_id": "MH2537-PLANET-MARS",
      "rule_type": "PLANET_SEMANTIC_SCOPE",
      "source_tier": 0,
      "source_refs": [
        "SRC-MH2537-PLANET-SYSTEM"
      ],
      "applicable_planets": [
        "mars"
      ],
      "applicable_taksa_roles": [
        "boriwan",
        "ayu",
        "det",
        "sri",
        "mula",
        "utsaha",
        "montri",
        "kalakini"
      ],
      "applicable_mahabhut_status_or_house": [
        "thongchai",
        "khumsap",
        "racha",
        "athibodi",
        "phangkha",
        "marana",
        "puti"
      ],
      "required_conditions": [
        "planet matches the life-period placement",
        "combine with an applicable Taksa-role rule and house-direction rule"
      ],
      "excluded_conditions": [
        "standalone planet keyword as prediction",
        "medical diagnosis",
        "personality substitution"
      ],
      "applicable_domains": [
        "action",
        "technical_work",
        "subordinates"
      ],
      "period_applicability": "Only the matched planet life period recorded by the source table.",
      "allowed_conclusions": [
        "Use การลงมือ งานเชิงช่าง ความเด็ดขาด และผู้ร่วมงานใต้ความรับผิดชอบ only to bound the subject affected by the matched house direction."
      ],
      "prohibited_escalations": [
        "specific event",
        "specific disease",
        "specific amount",
        "month or day timing",
        "different planet or life period"
      ],
      "claim_strength": "SOURCE_SEMANTIC_COMPONENT_NOT_STANDALONE_PREDICTION",
      "conflict_priority": 30,
      "reader_language_boundary": "Name the affected area in ordinary Thai; do not repeat historical disease or stereotype lists.",
      "authority_kind": "PRODUCT_INTERPRETATION_BOUNDARY",
      "evidence_completeness_status": "COMPLETE"
    },
    {
      "rule_id": "MH2537-PLANET-MERCURY",
      "rule_type": "PLANET_SEMANTIC_SCOPE",
      "source_tier": 0,
      "source_refs": [
        "SRC-MH2537-PLANET-SYSTEM"
      ],
      "applicable_planets": [
        "mercury"
      ],
      "applicable_taksa_roles": [
        "boriwan",
        "ayu",
        "det",
        "sri",
        "mula",
        "utsaha",
        "montri",
        "kalakini"
      ],
      "applicable_mahabhut_status_or_house": [
        "thongchai",
        "khumsap",
        "racha",
        "athibodi",
        "phangkha",
        "marana",
        "puti"
      ],
      "required_conditions": [
        "planet matches the life-period placement",
        "combine with an applicable Taksa-role rule and house-direction rule"
      ],
      "excluded_conditions": [
        "standalone planet keyword as prediction",
        "medical diagnosis",
        "personality substitution"
      ],
      "applicable_domains": [
        "communication",
        "education",
        "information_work"
      ],
      "period_applicability": "Only the matched planet life period recorded by the source table.",
      "allowed_conclusions": [
        "Use การสื่อสาร การเรียนรู้ ข้อมูล และงานที่ใช้คำพูดหรือเอกสาร only to bound the subject affected by the matched house direction."
      ],
      "prohibited_escalations": [
        "specific event",
        "specific disease",
        "specific amount",
        "month or day timing",
        "different planet or life period"
      ],
      "claim_strength": "SOURCE_SEMANTIC_COMPONENT_NOT_STANDALONE_PREDICTION",
      "conflict_priority": 30,
      "reader_language_boundary": "Name the affected area in ordinary Thai; do not repeat historical disease or stereotype lists.",
      "authority_kind": "PRODUCT_INTERPRETATION_BOUNDARY",
      "evidence_completeness_status": "COMPLETE"
    },
    {
      "rule_id": "MH2537-PLANET-JUPITER",
      "rule_type": "PLANET_SEMANTIC_SCOPE",
      "source_tier": 0,
      "source_refs": [
        "SRC-MH2537-PLANET-SYSTEM"
      ],
      "applicable_planets": [
        "jupiter"
      ],
      "applicable_taksa_roles": [
        "boriwan",
        "ayu",
        "det",
        "sri",
        "mula",
        "utsaha",
        "montri",
        "kalakini"
      ],
      "applicable_mahabhut_status_or_house": [
        "thongchai",
        "khumsap",
        "racha",
        "athibodi",
        "phangkha",
        "marana",
        "puti"
      ],
      "required_conditions": [
        "planet matches the life-period placement",
        "combine with an applicable Taksa-role rule and house-direction rule"
      ],
      "excluded_conditions": [
        "standalone planet keyword as prediction",
        "medical diagnosis",
        "personality substitution"
      ],
      "applicable_domains": [
        "knowledge",
        "advisers",
        "professional_work"
      ],
      "period_applicability": "Only the matched planet life period recorded by the source table.",
      "allowed_conclusions": [
        "Use ความรู้ ที่ปรึกษา การศึกษา และงานวิชาชีพ only to bound the subject affected by the matched house direction."
      ],
      "prohibited_escalations": [
        "specific event",